{
  "$schema": "http://json-schema.org/draft-04/schema#",
  "id": "/",
  "type": "object",
  "properties": {
    "copyrighter": {
      "id": "copyrighter",
      "type": "string"
    },
    "mission": {
      "id": "mission",
      "type": "array",
      "items": {
        "id": "2",
        "type": "object",
        "properties": {
          "description": {
            "id": "description",
            "type": "string"
          },
          "language": {
            "id": "language",
            "type": "string"
          }
        }
      }
    },
    "national_code": {
      "id": "national_code",
      "type": "string"
    },
    "subject_categories": {
      "id": "subject_categories",
      "type": "array",
      "items": {
        "id": "0",
        "type": "string"
      }
    },
    "current_status": {
      "id": "current_status",
      "type": "string"
    },
    "final_num": {
      "id": "final_num",
      "type": "string"
    },
    "publisher_country": {
      "id": "publisher_country",
      "type": "string"
    },
    "publisher_name": {
      "id": "publisher_name",
      "type": "string"
    },
    "eletronic_issn": {
      "id": "eletronic_issn",
      "type": "string"
    },
    "use_licenses": {
      "id": "use_licenses",
      "type": "object",
      "properties": {
        "reference_url": {
          "id": "reference_url",
          "type": "string"
        },
        "disclaimer": {
          "id": "disclaimer",
          "type": "string"
        },
        "license_code": {
          "id": "license_code",
          "type": "string"
        }
      }
    },
    "jid": {
      "id": "jid",
      "type": "string"
    },
    "title": {
      "id": "title",
      "type": "string"
    },
    "publisher_city": {
      "id": "publisher_city",
      "type": "string"
    },
    "final_year": {
      "id": "final_year",
      "type": "string"
    },
    "scielo_issn": {
      "id": "scielo_issn",
      "type": "string"
    },
    "collections": {
      "id": "collections",
      "type": "array",
      "items": {
        "id": "0",
        "type": "object",
        "properties": {
          "acronym": {
            "id": "acronym",
            "type": "string"
          },
          "name": {
            "id": "name",
            "type": "string"
          }
        }
      }
    },
    "init_year": {
      "id": "init_year",
      "type": "string"
    },
    "other_titles": {
      "id": "other_titles",
      "type": "array",
      "items": {
        "id": "0",
        "type": "object",
        "properties": {
          "category": {
            "id": "category",
            "type": "string"
          },
          "title": {
            "id": "title",
            "type": "string"
          }
        }
      }
    },
    "init_vol": {
      "id": "init_vol",
      "type": "string"
    },
    "updated": {
      "id": "updated",
      "type": "object",
      "properties": {}
    },
    "acronym": {
      "id": "acronym",
      "type": "string"
    },
    "timeline": {
      "id": "timeline",
      "type": "array",
      "items": {
        "id": "0",
        "type": "object",
        "properties": {
          "status": {
            "id": "status",
            "type": "string"
          },
          "reason": {
            "id": "reason",
            "type": "string"
          },
          "since": {
            "id": "since",
            "type": "object",
            "properties": {}
          }
        }
      }
    },
    "issue_count": {
      "id": "issue_count",
      "type": "integer"
    },
    "last_issue": {
      "id": "last_issue",
      "type": "object",
      "properties": {
        "start_month": {
          "id": "start_month",
          "type": "integer"
        },
        "iid": {
          "id": "iid",
          "type": "string"
        },
        "number": {
          "id": "number",
          "type": "string"
        },
        "label": {
          "id": "label",
          "type": "string"
        },
        "volume": {
          "id": "volume",
          "type": "string"
        },
        "end_month": {
          "id": "end_month",
          "type": "integer"
        },
        "bibliographic_legend": {
          "id": "bibliographic_legend",
          "type": "string"
        },
        "year": {
          "id": "year",
          "type": "integer"
        },
        "sections": {
          "id": "sections",
          "type": "array",
          "items": {
            "id": "8",
            "type": "string"
          }
        }
      }
    },
    "publisher_state": {
      "id": "publisher_state",
      "type": "string"
    },
    "sponsors": {
      "id": "sponsors",
      "type": "array",
      "items": {
        "id": "0",
        "type": "string"
      }
    },
    "online_submission_url": {
      "id": "online_submission_url",
      "type": "string"
    },
    "index_at": {
      "id": "index_at",
      "type": "array",
      "items": {}
    },
    "study_areas": {
      "id": "study_areas",
      "type": "array",
      "items": {
        "id": "0",
        "type": "string"
      }
    },
    "init_num": {
      "id": "init_num",
      "type": "string"
    },
    "social_networks": {
      "id": "social_networks",
      "type": "array",
      "items": {}
    },
    "created": {
      "id": "created",
      "type": "object",
      "properties": {}
    },
    "final_vol": {
      "id": "final_vol",
      "type": "string"
    },
    "short_title": {
      "id": "short_title",
      "type": "string"
    },
    "subject_descriptors": {
      "id": "subject_descriptors",
      "type": "array",
      "items": {
        "id": "1",
        "type": "string"
      }
    },
    "title_iso": {
      "id": "title_iso",
      "type": "string"
    },
    "_id": {
      "id": "_id",
      "type": "string"
    },
    "print_issn": {
      "id": "print_issn",
      "type": "string"
    }
  },
  "required": [
    "copyrighter",
    "mission",
    "national_code",
    "subject_categories",
    "current_status",
    "final_num",
    "publisher_country",
    "publisher_name",
    "eletronic_issn",
    "use_licenses",
    "jid",
    "title",
    "publisher_city",
    "final_year",
    "scielo_issn",
    "collections",
    "init_year",
    "other_titles",
    "init_vol",
    "updated",
    "acronym",
    "timeline",
    "issue_count",
    "last_issue",
    "publisher_state",
    "sponsors",
    "online_submission_url",
    "index_at",
    "study_areas",
    "init_num",
    "social_networks",
    "created",
    "final_vol",
    "short_title",
    "subject_descriptors",
    "title_iso",
    "_id",
    "print_issn"
  ]
}
