{
  "copyrighter": "Escola Nacional de Sa\\u00fade P\\u00fablica, Funda\\u00e7\\u00e3o Oswaldo Cruz",
  "mission": [
    {
      "description": "Publicar art\\u00edculos originales que contribuyan al estudio de la salud p\\u00fablica en general y de disciplinas afines como epidemiolog\\u00eda, nutrici\\u00f3n, parasitolog\\u00eda, ecolog\\u00eda y control de vectores, salud ambiental, pol\\u00edticas p\\u00fablicas y planificaci\\u00f3n en el \\u00e1mbito de la salud, ciencias sociales aplicadas a la salud, entre otras.",
      "language": "es"
    },
    {
      "description": "Publicar artigos originais que contribuam para o estudo da sa\\u00fade p\\u00fablica em geral e disciplinas afins, como epidemiologia, nutri\\u00e7\\u00e3o, parasitologia, ecologia e controles de vetores, sa\\u00fade ambiental, pol\\u00edticas p\\u00fablicas e planejamento em sa\\u00fade, ci\\u00eancias sociais aplicadas \\u00e0 sa\\u00fade, dentre outras.",
      "language": "pt"
    },
    {
      "description": "To publish original articles that contribute to the study of public health in general and to related disciplines such as epidemiology, nutrition, parasitology,vector ecology and control, environmental health, public polices and health planning, social sciences applied to health, and others.",
      "language": "en"
    }
  ],
  "national_code": "081953-0",
  "subject_categories": [
    "Health Policy & Services"
  ],
  "current_status": "current",
  "final_num": "",
  "publisher_country": "BR",
  "publisher_name": "Escola Nacional de Sa\\u00fade P\\u00fablica Sergio Arouca, Funda\\u00e7\\u00e3o Oswaldo Cruz",
  "eletronic_issn": "",
  "use_licenses": {
    "reference_url": "",
    "disclaimer": "<a rel=\"license\" href=\"\" \">Licencia Creative Commons</a>",
    "license_code": "BY-NC"
  },
  "jid": "3aa91899e58a42648091ffc5b741c86e",
  "title": "Cadernos de Sa\\u00fade P\\u00fablica",
  "publisher_city": "Rio de Janeiro",
  "final_year": "",
  "scielo_issn": "print",
  "collections": [
    {
      "acronym": "spa",
      "name": "Sa\\u00fade P\\u00fablica"
    }
  ],
  "init_year": "1985",
  "other_titles": [
    {
      "category": "other",
      "title": "Cad Saude Publica"
    }
  ],
  "init_vol": "1",
  "updated": {},
  "acronym": "csp",
  "timeline": [
    {
      "status": "current",
      "reason": "",
      "since": {}
    }
  ],
  "issue_count": 240,
  "last_issue": {
    "start_month": 9,
    "iid": "3dc9f72fa42545fcba6656faf0a6825a",
    "number": "9",
    "label": "30 (9)",
    "volume": "30",
    "end_month": 9,
    "bibliographic_legend": "Cad. sa\\u00fade p\\u00fablica vol.30 n.9 Rio de Janeiro Sep/Sep 2014",
    "year": 2014,
    "sections": [
      "Errata",
      "Erratum",
      "Article",
      "Artigo",
      "Review",
      "Perspectivas",
      "Editorial (Escolha das Editoras)",
      "Brief Communication",
      "Comunica\\u00e7\\u00e3o Breve"
    ]
  },
  "publisher_state": "RJ",
  "sponsors": [
    "CNPq - Conselho Nacional de Desenvolvimento Cient\\u00edfico e Tecnol\\u00f3gico "
  ],
  "online_submission_url": "",
  "index_at": [],
  "study_areas": [
    "Health Sciences"
  ],
  "init_num": "1",
  "social_networks": [],
  "created": {},
  "final_vol": "",
  "short_title": "Cad. Sa\\u00fade P\\u00fablica",
  "subject_descriptors": [
    "saude publica\\r",
    "saude coletiva"
  ],
  "title_iso": "Cad. sa\\u00fade p\\u00fablica",
  "_id": "3aa91899e58a42648091ffc5b741c86e",
  "print_issn": "0102-311X"
}
